SELECT @@wsrep_slave_threads = 8;
@@wsrep_slave_threads = 8
1
CREATE TABLE t1 (f1 INTEGER PRIMARY KEY, f2 INT);
INSERT INTO t1 VALUES (1, 0),(2, 0),(3, 0),(4, 0),(5, 0),(6, 0),(7, 0),(8, 0);
node_1
SELECT * FROM t1;
f1	f2
1	0
2	0
3	0
4	0
5	0
6	0
7	0
8	0
SET GLOBAL wsrep_provider_options='gcs.fc_limit=1K';
node_2
SELECT * FROM t1;
f1	f2
1	0
2	0
3	0
4	0
5	0
6	0
7	0
8	0
SET wsrep_on=OFF;
DELETE FROM t1 WHERE f1 = 2;
DELETE FROM t1 WHERE f1 = 4;
SET wsrep_on=ON;
node_2
SELECT * FROM t1;
f1	f2
1	0
3	0
5	0
6	0
7	0
8	0
LOCK TABLES t1 WRITE;
UPDATE t1 SET f2 = 1 WHERE f1 = 1;
UPDATE t1 SET f2 = 1 WHERE f1 = 2;
UPDATE t1 SET f2 = 1 WHERE f1 = 3;
UPDATE t1 SET f2 = 1 WHERE f1 = 4;
UPDATE t1 SET f2 = 2 WHERE f1 = 4;
/* dependent applier */
UPDATE t1 SET f2 = 3 WHERE f1 = 4;
/* dependent applier */
UPDATE t1 SET f2 = 1 WHERE f1 = 5;
UPDATE t1 SET f2 = 1 WHERE f1 = 6;
UPDATE t1 SET f2 = 1 WHERE f1 = 7;
UPDATE t1 SET f2 = 1 WHERE f1 = 8;
node_1
SELECT * FROM t1;
f1	f2
1	1
2	1
3	1
4	3
5	1
6	1
7	1
8	1
SET wsrep_on=OFF;
node_2
SELECT * FROM t1;
f1	f2
1	0
3	0
5	0
6	0
7	0
8	0
SET wsrep_on=ON;
UNLOCK TABLES;
Timeout in wait_condition.inc for SELECT 1 FROM performance_schema.GLOBAL_STATUS WHERE VARIABLE_NAME = 'wsrep_ready' AND VARIABLE_VALUE = 'OFF'
SHOW STATUS LIKE 'wsrep_cluster_size';
Variable_name	Value
wsrep_cluster_size	2
node_1
SELECT * FROM t1;
f1	f2
1	1
2	1
3	1
4	3
5	1
6	1
7	1
8	1
SET SESSION wsrep_on=OFF;
# restart
DROP TABLE t1;
CREATE TABLE t1 (f1 INTEGER PRIMARY KEY, f2 INT);
START TRANSACTION;
INSERT INTO t1 VALUES (1, 0);
INSERT INTO t1 VALUES (2, 0);
INSERT INTO t1 VALUES (3, 0);
INSERT INTO t1 VALUES (4, 0);
INSERT INTO t1 VALUES (5, 0);
INSERT INTO t1 VALUES (6, 0);
INSERT INTO t1 VALUES (7, 0);
INSERT INTO t1 VALUES (8, 0);
COMMIT;
CREATE TABLE t2 (f1 INTEGER PRIMARY KEY, f2 INT);
SET GLOBAL wsrep_provider_options='gcs.fc_limit=1K';
SET wsrep_on=OFF;
DROP TABLE t2;
SET wsrep_on=ON;
SET GLOBAL wsrep_provider_options = 'dbug=d,after_replicate_sync';
LOCK TABLES t1 READ;
UPDATE t1 SET f2 = 1 WHERE f1 = 1;
UPDATE t1 SET f2 = 1 WHERE f1 = 2;
UPDATE t1 SET f2 = 1 WHERE f1 = 3;
UPDATE t1 SET f2 = 1 WHERE f1 = 4;
UPDATE t1 SET f2 = 2 WHERE f1 = 4;
/* dependent applier */;
DROP TABLE t2;;
SET wsrep_on=OFF;
"Wait for DROP TABLE to replicate"
SET SESSION wsrep_on = 0;
SET SESSION wsrep_on = 0;
SET GLOBAL wsrep_provider_options = 'signal=after_replicate_sync';
SET GLOBAL wsrep_provider_options = 'dbug=';
"DROP TABLE replicated"
SET wsrep_on=ON;
UPDATE t1 SET f2 = 3 WHERE f1 = 4;
/* dependent applier */
UPDATE t1 SET f2 = 1 WHERE f1 = 5;
UPDATE t1 SET f2 = 1 WHERE f1 = 6;
UPDATE t1 SET f2 = 1 WHERE f1 = 7;
UPDATE t1 SET f2 = 1 WHERE f1 = 8;
SET wsrep_on=OFF;
SET wsrep_on=ON;
UNLOCK TABLES;
ERROR 42S02: Unknown table 'test.t2'
SHOW STATUS LIKE 'wsrep_cluster_size';
Variable_name	Value
wsrep_cluster_size	2
SELECT * FROM t1;
f1	f2
1	1
2	1
3	1
4	3
5	1
6	1
7	1
8	1
Timeout in wait_condition.inc for SELECT 1 FROM performance_schema.GLOBAL_STATUS WHERE VARIABLE_NAME = 'wsrep_ready' AND VARIABLE_VALUE = 'OFF'
SET SESSION wsrep_on=OFF;
# restart
DROP TABLE t1;
