#node-1
SET SESSION wsrep_on=OFF;
RESET BINARY LOGS AND GTIDS;
SET SESSION wsrep_on=ON;
#node-2
SET SESSION wsrep_on=OFF;
RESET BINARY LOGS AND GTIDS;
SET SESSION wsrep_on=ON;
#node-1
CREATE TABLE t1 (f1 INT PRIMARY KEY);
SET SESSION wsrep_trx_fragment_size=1;
INSERT INTO t1 VALUES (1);
#node-2
SELECT COUNT(*) = 1 FROM t1;
COUNT(*) = 1
1
SET SESSION wsrep_trx_fragment_size=1;
UPDATE t1 SET f1 = 2;
#node-1
SET SESSION wsrep_trx_fragment_size=0;
#node-2
SET SESSION wsrep_trx_fragment_size=0;
#node-1
SELECT COUNT(*) = 1 FROM t1 WHERE f1 = 2;
COUNT(*) = 1
1
gtid_executed_equal
1
include/rpl/deprecated/show_binlog_events.inc
Log_name	Pos	Event_type	Server_id	End_log_pos	Info
mysqld-bin.000001	#	Previous_gtids	#	#	
mysqld-bin.000001	#	Anonymous_Gtid	#	#	SET @@SESSION.GTID_NEXT= 'ANONYMOUS'
mysqld-bin.000001	#	Query	#	#	use `test`; CREATE TABLE t1 (f1 INT PRIMARY KEY)
mysqld-bin.000001	#	Anonymous_Gtid	#	#	SET @@SESSION.GTID_NEXT= 'ANONYMOUS'
mysqld-bin.000001	#	Query	#	#	BEGIN
mysqld-bin.000001	#	Table_map	#	#	table_id: # (test.t1)
mysqld-bin.000001	#	Write_rows	#	#	table_id: # flags: STMT_END_F
mysqld-bin.000001	#	Xid	#	#	COMMIT /* XID */
mysqld-bin.000001	#	Anonymous_Gtid	#	#	SET @@SESSION.GTID_NEXT= 'ANONYMOUS'
mysqld-bin.000001	#	Query	#	#	BEGIN
mysqld-bin.000001	#	Table_map	#	#	table_id: # (test.t1)
mysqld-bin.000001	#	Update_rows	#	#	table_id: # flags: STMT_END_F
mysqld-bin.000001	#	Xid	#	#	COMMIT /* XID */
#node-2
SELECT 1 FROM DUAL;
1
1
include/rpl/deprecated/show_binlog_events.inc
Log_name	Pos	Event_type	Server_id	End_log_pos	Info
mysqld-bin.000001	#	Previous_gtids	#	#	
mysqld-bin.000001	#	Anonymous_Gtid	#	#	SET @@SESSION.GTID_NEXT= 'ANONYMOUS'
mysqld-bin.000001	#	Query	#	#	use `test`; CREATE TABLE t1 (f1 INT PRIMARY KEY)
mysqld-bin.000001	#	Anonymous_Gtid	#	#	SET @@SESSION.GTID_NEXT= 'ANONYMOUS'
mysqld-bin.000001	#	Query	#	#	BEGIN
mysqld-bin.000001	#	Table_map	#	#	table_id: # (test.t1)
mysqld-bin.000001	#	Write_rows	#	#	table_id: # flags: STMT_END_F
mysqld-bin.000001	#	Xid	#	#	COMMIT /* XID */
mysqld-bin.000001	#	Anonymous_Gtid	#	#	SET @@SESSION.GTID_NEXT= 'ANONYMOUS'
mysqld-bin.000001	#	Query	#	#	BEGIN
mysqld-bin.000001	#	Table_map	#	#	table_id: # (test.t1)
mysqld-bin.000001	#	Update_rows	#	#	table_id: # flags: STMT_END_F
mysqld-bin.000001	#	Xid	#	#	COMMIT /* XID */
DROP TABLE t1;
