#node-1
SET SESSION wsrep_on=OFF;
RESET MASTER;
SET SESSION wsrep_on=ON;
#node-2
SET SESSION wsrep_on=OFF;
RESET MASTER;
SET SESSION wsrep_on=ON;
#node-1
CREATE TABLE t1 (f1 INT PRIMARY KEY);
SET SESSION wsrep_trx_fragment_size=1;
INSERT INTO t1 VALUES (1);
#node-2
SELECT COUNT(*) = 1 FROM t1;
COUNT(*) = 1
1
SET SESSION wsrep_trx_fragment_size=1;
UPDATE t1 SET f1 = 2;
#node-1
SET SESSION wsrep_trx_fragment_size=0;
#node-2
SET SESSION wsrep_trx_fragment_size=0;
#node-1
SELECT COUNT(*) = 1 FROM t1 WHERE f1 = 2;
COUNT(*) = 1
1
gtid_executed_equal
1
SHOW BINLOG EVENTS IN 'mysqld-bin.000001' FROM 125;
Log_name	Pos	Event_type	Server_id	End_log_pos	Info
mysqld-bin.000001	125	Previous_gtids	1	156	
mysqld-bin.000001	156	Anonymous_Gtid	1	233	SET @@SESSION.GTID_NEXT= 'ANONYMOUS'
mysqld-bin.000001	233	Query	1	357	use `test`; CREATE TABLE t1 (f1 INT PRIMARY KEY) /* xid=### */
mysqld-bin.000001	357	Anonymous_Gtid	1	436	SET @@SESSION.GTID_NEXT= 'ANONYMOUS'
mysqld-bin.000001	436	Query	1	516	BEGIN
mysqld-bin.000001	516	Table_map	1	564	table_id: ### (test.t1)
mysqld-bin.000001	564	Write_rows	1	604	table_id: ### flags: STMT_END_F
mysqld-bin.000001	604	Xid	1	635	COMMIT /* xid=### */
mysqld-bin.000001	635	Anonymous_Gtid	2	714	SET @@SESSION.GTID_NEXT= 'ANONYMOUS'
mysqld-bin.000001	714	Query	2	789	BEGIN
mysqld-bin.000001	789	Table_map	2	837	table_id: ### (test.t1)
mysqld-bin.000001	837	Update_rows	2	883	table_id: ### flags: STMT_END_F
mysqld-bin.000001	883	Xid	2	914	COMMIT /* xid=### */
#node-2
SELECT 1 FROM DUAL;
1
1
SHOW BINLOG EVENTS IN 'mysqld-bin.000001' FROM 125;
Log_name	Pos	Event_type	Server_id	End_log_pos	Info
mysqld-bin.000001	125	Previous_gtids	2	156	
mysqld-bin.000001	156	Anonymous_Gtid	1	233	SET @@SESSION.GTID_NEXT= 'ANONYMOUS'
mysqld-bin.000001	233	Query	1	357	use `test`; CREATE TABLE t1 (f1 INT PRIMARY KEY) /* xid=### */
mysqld-bin.000001	357	Anonymous_Gtid	1	436	SET @@SESSION.GTID_NEXT= 'ANONYMOUS'
mysqld-bin.000001	436	Query	1	511	BEGIN
mysqld-bin.000001	511	Table_map	1	559	table_id: ### (test.t1)
mysqld-bin.000001	559	Write_rows	1	599	table_id: ### flags: STMT_END_F
mysqld-bin.000001	599	Xid	1	630	COMMIT /* xid=### */
mysqld-bin.000001	630	Anonymous_Gtid	2	709	SET @@SESSION.GTID_NEXT= 'ANONYMOUS'
mysqld-bin.000001	709	Query	2	798	BEGIN
mysqld-bin.000001	798	Table_map	2	846	table_id: ### (test.t1)
mysqld-bin.000001	846	Update_rows	2	892	table_id: ### flags: STMT_END_F
mysqld-bin.000001	892	Xid	2	923	COMMIT /* xid=### */
DROP TABLE t1;
