SET SESSION wsrep_on=OFF;
RESET BINARY LOGS AND GTIDS;
SET SESSION wsrep_on=ON;
SET SESSION wsrep_on=OFF;
RESET BINARY LOGS AND GTIDS;
SET SESSION wsrep_on=ON;
CREATE TABLE t1 (f1 INT PRIMARY KEY) ENGINE=InnoDB;
INSERT INTO t1 VALUES (1);
SELECT COUNT(*) = 1 FROM t1;
COUNT(*) = 1
1
UPDATE t1 SET f1 = 2 WHERE f1 = 1;
SELECT COUNT(*) = 1 FROM t1 WHERE f1 = 2;
COUNT(*) = 1
1
include/rpl/deprecated/show_binlog_events.inc
Log_name	Pos	Event_type	Server_id	End_log_pos	Info
mysqld-bin.000001	#	Rows_query	#	#	# INSERT INTO t1 VALUES (1)
DROP TABLE t1;
SET SESSION wsrep_on=OFF;
RESET BINARY LOGS AND GTIDS;
SET SESSION wsrep_on=ON;
SET SESSION wsrep_on=OFF;
RESET BINARY LOGS AND GTIDS;
SET SESSION wsrep_on=ON;
