call mtr.add_suppression("Trying to desync a node that is already paused");
** Test #1 **
CREATE TABLE t1 (f1 INTEGER) Engine=InnoDB;
SET GLOBAL wsrep_desync=1;
SET wsrep_OSU_method=RSU;
Variable_name	Value
wsrep_desync	ON
Variable_name	Value
wsrep_desync_count	1
SET DEBUG_SYNC = 'alter_table_before_open_tables WAIT_FOR continue';
ALTER TABLE t1 ADD COLUMN f2 INTEGER;;
Variable_name	Value
wsrep_desync	ON
Variable_name	Value
wsrep_desync_count	2
SET GLOBAL wsrep_desync=0;
Variable_name	Value
wsrep_desync	OFF
Variable_name	Value
wsrep_desync_count	1
SET DEBUG_SYNC= 'now SIGNAL continue';
SHOW CREATE TABLE t1;
Table	Create Table
t1	CREATE TABLE `t1` (
  `f1` int(11) DEFAULT NULL,
  `f2` int(11) DEFAULT NULL
) ENGINE=InnoDB DEFAULT CHARSET=utf8mb4 COLLATE=utf8mb4_0900_ai_ci
Variable_name	Value
wsrep_desync_count	0
Variable_name	Value
wsrep_desync	OFF
SET wsrep_OSU_method=TOI;
DROP TABLE t1;
** Test #2 **
CREATE TABLE t1 (f1 INTEGER) Engine=InnoDB;
SET GLOBAL wsrep_desync=1;
Variable_name	Value
wsrep_desync	ON
Variable_name	Value
wsrep_desync_count	1
FLUSH TABLE WITH READ LOCK;
Variable_name	Value
wsrep_desync	ON
Variable_name	Value
wsrep_desync_count	2
SET GLOBAL wsrep_desync=0;
ERROR HY000: Explictly desync/resync of already desynced/paused node is prohibited
Variable_name	Value
wsrep_desync	ON
Variable_name	Value
wsrep_desync_count	2
UNLOCK TABLES;
Variable_name	Value
wsrep_desync	ON
Variable_name	Value
wsrep_desync_count	1
SET GLOBAL wsrep_desync=0;
Variable_name	Value
wsrep_desync	OFF
Variable_name	Value
wsrep_desync_count	0
DROP TABLE t1;
** Test #3 **
CREATE TABLE t1 (f1 INTEGER) Engine=InnoDB;
SET GLOBAL wsrep_desync=0;
Warnings:
Warning	1231	'wsrep_desync' is already OFF.
SET wsrep_OSU_method=RSU;
Variable_name	Value
wsrep_desync	OFF
Variable_name	Value
wsrep_desync_count	0
SET DEBUG_SYNC = 'alter_table_before_create_table_no_lock WAIT_FOR continue';
ALTER TABLE t1 ADD COLUMN f2 INTEGER;;
Variable_name	Value
wsrep_desync	OFF
Variable_name	Value
wsrep_desync_count	1
SET GLOBAL wsrep_desync=1;;
Variable_name	Value
wsrep_desync	OFF
Variable_name	Value
wsrep_desync_count	2
SET DEBUG_SYNC= 'now SIGNAL continue';
SHOW CREATE TABLE t1;
Table	Create Table
t1	CREATE TABLE `t1` (
  `f1` int(11) DEFAULT NULL,
  `f2` int(11) DEFAULT NULL
) ENGINE=InnoDB DEFAULT CHARSET=utf8mb4 COLLATE=utf8mb4_0900_ai_ci
Variable_name	Value
wsrep_desync_count	1
SET GLOBAL wsrep_desync=0;
Variable_name	Value
wsrep_desync	OFF
Variable_name	Value
wsrep_desync_count	0
SET wsrep_OSU_method=TOI;
DROP TABLE t1;
** Test #4 **
CREATE TABLE t1 (f1 INTEGER) Engine=InnoDB;
FLUSH TABLE WITH READ LOCK;
Variable_name	Value
wsrep_desync	OFF
Variable_name	Value
wsrep_desync_count	1
SET GLOBAL wsrep_desync=1;;
Variable_name	Value
wsrep_desync	OFF
Variable_name	Value
wsrep_desync_count	2
UNLOCK TABLES;
Variable_name	Value
wsrep_desync_count	1
SET GLOBAL wsrep_desync=0;
Variable_name	Value
wsrep_desync	OFF
Variable_name	Value
wsrep_desync_count	0
DROP TABLE t1;
#node-1
create table t1 (i int, primary key pk(i));
insert into t1 values (1), (2), (3), (4);
select * from t1;
i
1
2
3
4
begin;
update t1 set i = i + 100;
select * from t1;
i
101
102
103
104
SET SESSION wsrep_OSU_method=RSU;
CREATE TEMPORARY TABLE ch3 AS SELECT concat(b1.b, b2.b) AS ch FROM t2 b1, t2 b2;
ERROR 42S02: Table 'test.t2' doesn't exist
commit;
SET SESSION wsrep_OSU_method=TOI;
select * from t1;
i
101
102
103
104
drop table t1;
#node-2
