#node-1
use test;
CREATE TABLE example (id INT NOT NULL PRIMARY KEY, name VARCHAR(64));
INSERT INTO example VALUES(0, 'zero');
BEGIN;
INSERT INTO example VALUES(1, 'first!');
SAVEPOINT savepoint001;
ROLLBACK TO SAVEPOINT savepoint001;
INSERT INTO example VALUES(2, 'second');
COMMIT;
SELECT * FROM example;
id	name
0	zero
1	first!
2	second
#node-2
SELECT * FROM example;
id	name
0	zero
1	first!
2	second
#node-1
DROP TABLE example;
#node-1
use test;
CREATE TABLE example (id INT NOT NULL PRIMARY KEY, name VARCHAR(64));
BEGIN;
SAVEPOINT savepoint001;
INSERT INTO example VALUES(2, 'second');
SELECT * FROM example;
id	name
2	second
ROLLBACK TO SAVEPOINT savepoint001;
COMMIT;
SELECT * FROM example;
id	name
#node-2
SELECT * FROM example;
id	name
#node-1
DROP TABLE example;
#node-1
use test;
create table t1 (i int, j int, primary key pk(i));
create table t3 (i int, primary key pk(i));
insert into t1 values (1, 1), (2, 2), (3, 3), (4, 4);
insert into t3 values (100), (200), (300), (400);
select * from t1;
i	j
1	1
2	2
3	3
4	4
select * from t3;
i
100
200
300
400
SET SESSION wsrep_sync_wait = 0;
SET DEBUG_SYNC = "pxc_rollback_to_savepoint SIGNAL entered1 WAIT_FOR continue1";
begin;
update t1 set i = i + 10;
savepoint s1;
update t3 set i = i + 1000;
select * from t1;
i	j
11	1
12	2
13	3
14	4
select * from t3;
i
1100
1200
1300
1400
rollback to savepoint s1;;
#node-1a
SET SESSION wsrep_sync_wait = 0;
SET DEBUG_SYNC = "now WAIT_FOR entered1";
use test;
alter table t1 add index idx(j);
SET DEBUG_SYNC = "now SIGNAL continue1";
#node-1
ERROR 40001: Deadlock found when trying to get lock; try restarting transaction
select * from t1;
i	j
1	1
2	2
3	3
4	4
select * from t3;
i
100
200
300
400
SET DEBUG_SYNC = 'RESET';
drop table t1, t3;
create table t1 (id int, c char(10), primary key pk(id));
create table t2 (id int, c char(10), primary key pk(id));
create trigger ins_t2 after insert on t1 for each row insert into t2 values (new.id);
begin;
insert into t1 values (1, 'portugal');
ERROR 21S01: Column count doesn't match value count at row 1
commit;
select * from t1;
id	c
select * from t2;
id	c
drop trigger ins_t2;
drop table t1, t2;
