CREATE TABLE t1 (f1 INTEGER PRIMARY KEY, f2 int, f3 int,  unique key keyj (f2));
INSERT INTO t1 VALUES (1, 1, 0);
INSERT INTO t1 VALUES (3, 3, 0);
INSERT INTO t1 VALUES (10, 10, 0);
SET GLOBAL wsrep_slave_threads = 3;
SET GLOBAL debug = "d,sync.wsrep_apply_cb";
SET SESSION wsrep_sync_wait=0;
START TRANSACTION;
DELETE FROM t1 WHERE f2 = 3;
INSERT INTO t1 VALUES (3, 3, 1);
SET SESSION wsrep_sync_wait=0;
INSERT INTO t1 VALUES (5, 5, 2);
SET SESSION DEBUG_SYNC = "now WAIT_FOR sync.wsrep_apply_cb_reached";
SET GLOBAL wsrep_provider_options = 'dbug=d,apply_monitor_slave_enter_sync';
INSERT INTO t1 VALUES (4, 4, 2);
SET SESSION wsrep_on = 0;
SET SESSION wsrep_on = 1;
SET GLOBAL wsrep_provider_options = 'dbug=';
SET GLOBAL wsrep_provider_options = 'dbug=d,commit_monitor_enter_sync';
COMMIT;
SET SESSION wsrep_on = 0;
SET SESSION wsrep_on = 1;
SET GLOBAL wsrep_provider_options = 'dbug=';
SET GLOBAL wsrep_provider_options = 'signal=commit_monitor_enter_sync';
SET GLOBAL wsrep_provider_options = 'dbug=';
SET GLOBAL debug = "";
SET DEBUG_SYNC = "now SIGNAL signal.wsrep_apply_cb";
SET GLOBAL debug = NULL;
SET debug_sync='RESET';
SET GLOBAL debug = "d,sync.wsrep_apply_cb";
SET GLOBAL wsrep_provider_options = 'signal=apply_monitor_slave_enter_sync';
SET SESSION DEBUG_SYNC = "now WAIT_FOR sync.wsrep_apply_cb_reached";
SET GLOBAL wsrep_provider_options = 'dbug=d,commit_monitor_enter_sync';
SET GLOBAL wsrep_provider_options = 'dbug=';
SET GLOBAL debug = "";
SET DEBUG_SYNC = "now SIGNAL signal.wsrep_apply_cb";
SET GLOBAL debug = NULL;
SET debug_sync='RESET';
SET GLOBAL wsrep_provider_options = 'signal=commit_monitor_enter_sync';
SET GLOBAL wsrep_provider_options = 'dbug=';
SELECT * FROM t1;
f1	f2	f3
1	1	0
3	3	1
4	4	2
5	5	2
10	10	0
wsrep_local_replays
1
SET GLOBAL wsrep_slave_threads = DEFAULT;
SELECT * FROM t1;
f1	f2	f3
1	1	0
3	3	1
4	4	2
5	5	2
10	10	0
INSERT INTO t1 VALUES (7,7,7);
INSERT INTO t1 VALUES (8,8,8);
DROP TABLE t1;
Test scenario 2
CREATE TABLE t1 (f1 INTEGER PRIMARY KEY, f2 int, f3 int,  unique key keyj (f2));
INSERT INTO t1 VALUES (1, 1, 0);
INSERT INTO t1 VALUES (3, 3, 0);
INSERT INTO t1 VALUES (10, 10, 0);
SET GLOBAL wsrep_slave_threads = 3;
SET GLOBAL wsrep_provider_options = 'dbug=d,apply_monitor_slave_enter_sync';
SET SESSION wsrep_sync_wait=0;
START TRANSACTION;
DELETE FROM t1 WHERE f2 = 3;
INSERT INTO t1 VALUES (3, 3, 1);
SET SESSION wsrep_sync_wait=0;
INSERT INTO t1 VALUES (5, 5, 2);
SET SESSION wsrep_on = 0;
SET SESSION wsrep_on = 1;
SET GLOBAL wsrep_provider_options = 'dbug=';
SET GLOBAL wsrep_provider_options = 'dbug=d,commit_monitor_enter_sync';
COMMIT;
SET SESSION wsrep_on = 0;
SET SESSION wsrep_on = 1;
SET GLOBAL wsrep_provider_options = 'dbug=';
SET GLOBAL debug = "d,sync.wsrep_replay_cb";
SET GLOBAL wsrep_provider_options = 'signal=commit_monitor_enter_sync';
SET GLOBAL wsrep_provider_options = 'dbug=';
SET GLOBAL wsrep_provider_options = 'signal=apply_monitor_slave_enter_sync';
SET GLOBAL wsrep_provider_options = 'dbug=';
SET SESSION DEBUG_SYNC = "now WAIT_FOR sync.wsrep_replay_cb_reached";
INSERT INTO t1 VALUES (4, 4, 2);
SET GLOBAL debug = "";
SET DEBUG_SYNC = "now SIGNAL signal.wsrep_replay_cb";
SET GLOBAL debug = NULL;
SET debug_sync='RESET';
SET GLOBAL wsrep_slave_threads = DEFAULT;
wsrep_local_replays
1
SELECT * FROM t1;
f1	f2	f3
1	1	0
3	3	1
4	4	2
5	5	2
10	10	0
INSERT INTO t1 VALUES (7,7,7);
INSERT INTO t1 VALUES (8,8,8);
DROP TABLE t1;
