SET SESSION wsrep_on=OFF;
RESET MASTER;
SET SESSION wsrep_on=ON;
SET SESSION wsrep_on=OFF;
RESET MASTER;
SET SESSION wsrep_on=ON;
CREATE TABLE t1 (f1 INT PRIMARY KEY) ENGINE=InnoDB;
INSERT INTO t1 VALUES (1);
SELECT COUNT(*) = 1 FROM t1;
COUNT(*) = 1
1
UPDATE t1 SET f1 = 2 WHERE f1 = 1;
SELECT COUNT(*) = 1 FROM t1 WHERE f1 = 2;
COUNT(*) = 1
1
SHOW BINLOG EVENTS IN 'mysqld-bin.000001' FROM 485 LIMIT 1;
Log_name	Pos	Event_type	Server_id	End_log_pos	Info
mysqld-bin.000001	485	Rows_query	2	534	# INSERT INTO t1 VALUES (1)
DROP TABLE t1;
SET SESSION wsrep_on=OFF;
RESET MASTER;
SET SESSION wsrep_on=ON;
SET SESSION wsrep_on=OFF;
RESET MASTER;
SET SESSION wsrep_on=ON;
