CREATE TABLE t1 (f1 INTEGER PRIMARY KEY) ENGINE=InnoDB;
INSERT INTO t1 VALUES (1),(2);
INSERT INTO t1 VALUES (3),(4);
SELECT COUNT(*) = 4 FROM t1;
COUNT(*) = 4
1
SELECT COUNT(*) = 4 FROM t1;
COUNT(*) = 4
1
DROP TABLE t1;
CREATE TABLE t1 (f1 INTEGER, KEY (f1)) ENGINE=InnoDB;
INSERT INTO t1 VALUES (1),(1);
INSERT INTO t1 VALUES (2),(2);
SELECT COUNT(*) = 4 FROM t1;
COUNT(*) = 4
1
SELECT COUNT(*) = 4 FROM t1;
COUNT(*) = 4
1
DROP TABLE t1;
CREATE TABLE t1 (f1 INTEGER PRIMARY KEY) ENGINE=InnoDB;
INSERT INTO t1 VALUES (1), (2), (3), (4), (5), (6), (7), (8), (9), (1);
ERROR 23000: Duplicate entry '1' for key 'PRIMARY'
SELECT COUNT(*) = 0 FROM t1;
COUNT(*) = 0
1
SELECT COUNT(*) = 0 FROM t1;
COUNT(*) = 0
1
DROP TABLE t1;
CREATE TABLE t1(f1 INTEGER, f2 INTEGER, PRIMARY KEY pkf1(f1)) ENGINE=InnoDB;
INSERT INTO t1 VALUES (1, 2), (2, 2);
BEGIN;
INSERT INTO t1 VALUES (3, 2), (2, 2);
ERROR 23000: Duplicate entry '2' for key 'PRIMARY'
BEGIN;
SELECT * FROM t1;
f1	f2
1	2
2	2
SELECT * FROM t1;
f1	f2
1	2
2	2
UPDATE t1 SET f1 = 100 WHERE f2 = 2;
ERROR 23000: Duplicate entry '100' for key 'PRIMARY'
BEGIN;
SELECT * FROM t1;
f1	f2
1	2
2	2
SELECT * FROM t1;
f1	f2
1	2
2	2
INSERT IGNORE INTO t1 VALUES (3, 2), (2, 2);
BEGIN;
SELECT * FROM t1;
f1	f2
1	2
2	2
3	2
COMMIT;
SELECT * FROM t1;
f1	f2
1	2
2	2
3	2
DROP TABLE t1;
CREATE TABLE t1 (f1 INTEGER PRIMARY KEY) ENGINE=InnoDB;
SET AUTOCOMMIT = OFF;
START TRANSACTION;
INSERT INTO t1 VALUES (1), (2);
SET AUTOCOMMIT = OFF;
START TRANSACTION;
INSERT INTO t1 VALUES (2), (1);
COMMIT;
COMMIT;
Got one of the listed errors
ROLLBACK;
INSERT INTO t1 VALUES (1), (2);
ERROR 23000: Duplicate entry '1' for key 'PRIMARY'
DROP TABLE t1;
CREATE TABLE t1 (f1 INTEGER PRIMARY KEY) ENGINE=InnoDB;
START TRANSACTION;
INSERT INTO t1 VALUES (1), (2);
START TRANSACTION;
INSERT INTO t1 VALUES (2), (1);
ROLLBACK;
COMMIT;
SELECT COUNT(*) = 2 FROM t1;
COUNT(*) = 2
1
SELECT COUNT(*) = 2 FROM t1;
COUNT(*) = 2
1
DROP TABLE t1;
