#node-2 (galera-cluster-node acting as slave to an independent master)
START SLAVE USER='root';
Warnings:
Warning	1287	'START SLAVE' is deprecated and will be removed in a future release. Please use START REPLICA instead
Note	1759	Sending passwords in plain text without SSL/TLS is extremely insecure.
#node-4 (independent slave replicating from galera-node-2)
START SLAVE USER='root';
Warnings:
Warning	1287	'START SLAVE' is deprecated and will be removed in a future release. Please use START REPLICA instead
Note	1759	Sending passwords in plain text without SSL/TLS is extremely insecure.
#node-1 (independent master)
use test;
create table t (i int, c char(10), primary key pk(i)) engine=innodb;
insert into t values (1, 'aaaaaa'), (2, 'bbbbbb'), (3, 'cccccc'),
(4, 'dddddd'), (5, 'eeeeee');
select locate(':1-2', @@global.gtid_executed);
locate(':1-2', @@global.gtid_executed)
VALID_POS
select * from t;
i	c
1	aaaaaa
2	bbbbbb
3	cccccc
4	dddddd
5	eeeeee
#node-2 (galera-cluster-node acting as slave to an independent master)
select * from t;
i	c
1	aaaaaa
2	bbbbbb
3	cccccc
4	dddddd
5	eeeeee
#node-3 (galera-cluster-node-2 that act as master to independent slave)
select * from t;
i	c
1	aaaaaa
2	bbbbbb
3	cccccc
4	dddddd
5	eeeeee
#node-4 (independent slave replicating from galera-node-2)
select * from t;
i	c
1	aaaaaa
2	bbbbbb
3	cccccc
4	dddddd
5	eeeeee
select @@slave_parallel_workers;
@@slave_parallel_workers
0
Warnings:
Warning	1287	'@@slave_parallel_workers' is deprecated and will be removed in a future release. Please use replica_parallel_workers instead.
set global slave_parallel_workers=2;
Warnings:
Warning	1287	'@@slave_parallel_workers' is deprecated and will be removed in a future release. Please use replica_parallel_workers instead.
select @@slave_parallel_workers;
@@slave_parallel_workers
2
Warnings:
Warning	1287	'@@slave_parallel_workers' is deprecated and will be removed in a future release. Please use replica_parallel_workers instead.
STOP SLAVE;
Warnings:
Warning	1287	'STOP SLAVE' is deprecated and will be removed in a future release. Please use STOP REPLICA instead
START SLAVE USER='root';
Warnings:
Warning	1287	'START SLAVE' is deprecated and will be removed in a future release. Please use START REPLICA instead
Note	1759	Sending passwords in plain text without SSL/TLS is extremely insecure.
#node-1 (independent master)
use test;
insert into t values (1000, 'aaaaaa');
insert into t values (2000, 'bbbbbb');
select locate(':1-4', @@global.gtid_executed);
locate(':1-4', @@global.gtid_executed)
VALID_POS
select * from t;
i	c
1	aaaaaa
2	bbbbbb
3	cccccc
4	dddddd
5	eeeeee
1000	aaaaaa
2000	bbbbbb
#node-2 (galera-cluster-node acting as slave to an independent master)
select * from t;
i	c
1	aaaaaa
2	bbbbbb
3	cccccc
4	dddddd
5	eeeeee
1000	aaaaaa
2000	bbbbbb
select left(@@global.gtid_executed, 36) = '<master_id>';;
left(@@global.gtid_executed, 36) = '<master_id>'
1
#node-3 (galera-cluster-node-2 that act as master to independent slave)
select * from t;
i	c
1	aaaaaa
2	bbbbbb
3	cccccc
4	dddddd
5	eeeeee
1000	aaaaaa
2000	bbbbbb
select left(@@global.gtid_executed, 36) = '<master_id>';;
left(@@global.gtid_executed, 36) = '<master_id>'
1
#node-4 (independent slave replicating from galera-node-2)
select * from t;
i	c
1	aaaaaa
2	bbbbbb
3	cccccc
4	dddddd
5	eeeeee
1000	aaaaaa
2000	bbbbbb
select left(@@global.gtid_executed, 36) = '<master_id>';;
left(@@global.gtid_executed, 36) = '<master_id>'
1
select @@slave_parallel_workers;
@@slave_parallel_workers
2
Warnings:
Warning	1287	'@@slave_parallel_workers' is deprecated and will be removed in a future release. Please use replica_parallel_workers instead.
set global slave_parallel_workers=0;
Warnings:
Warning	1287	'@@slave_parallel_workers' is deprecated and will be removed in a future release. Please use replica_parallel_workers instead.
select @@slave_parallel_workers;
@@slave_parallel_workers
0
Warnings:
Warning	1287	'@@slave_parallel_workers' is deprecated and will be removed in a future release. Please use replica_parallel_workers instead.
STOP SLAVE;
Warnings:
Warning	1287	'STOP SLAVE' is deprecated and will be removed in a future release. Please use STOP REPLICA instead
START SLAVE USER='root';
Warnings:
Warning	1287	'START SLAVE' is deprecated and will be removed in a future release. Please use START REPLICA instead
Note	1759	Sending passwords in plain text without SSL/TLS is extremely insecure.
#node-2 (galera-cluster-node acting as slave to an independent master)
delete from t where i = 2;
update t set c = 'zzzzzz' where i = 4;
update t set c = 'pppppp', i = 50 where i = 5;
select * from t;
i	c
1	aaaaaa
3	cccccc
4	zzzzzz
50	pppppp
1000	aaaaaa
2000	bbbbbb
select locate(':1-3', @@global.gtid_executed);
locate(':1-3', @@global.gtid_executed)
VALID_POS
#node-4 (independent slave replicating from galera-node-2)
select * from t;
i	c
1	aaaaaa
3	cccccc
4	zzzzzz
50	pppppp
1000	aaaaaa
2000	bbbbbb
select locate(':1-3', @@global.gtid_executed);
locate(':1-3', @@global.gtid_executed)
VALID_POS
#node-1 (independent master)
delete from t where i = 2;
update t set c = 'zzzzzz' where i = 4;
update t set c = 'pppppp', i = 50 where i = 5;
select * from t;
i	c
1	aaaaaa
3	cccccc
4	zzzzzz
50	pppppp
1000	aaaaaa
2000	bbbbbb
select locate(':1-7', @@global.gtid_executed);
locate(':1-7', @@global.gtid_executed)
VALID_POS
#node-2 (galera-cluster-node acting as slave to an independent master)
select * from t;
i	c
1	aaaaaa
3	cccccc
4	zzzzzz
50	pppppp
1000	aaaaaa
2000	bbbbbb
select locate(':1-7', @@global.gtid_executed);
locate(':1-7', @@global.gtid_executed)
VALID_POS
#node-3 (galera-cluster-node-2 that act as master to independent slave)
select * from t;
i	c
1	aaaaaa
3	cccccc
4	zzzzzz
50	pppppp
1000	aaaaaa
2000	bbbbbb
select locate(':1-7', @@global.gtid_executed);
locate(':1-7', @@global.gtid_executed)
VALID_POS
#node-4 (independent slave replicating from galera-node-2)
select * from t;
i	c
1	aaaaaa
3	cccccc
4	zzzzzz
50	pppppp
1000	aaaaaa
2000	bbbbbb
select locate(':1-7', @@global.gtid_executed);
locate(':1-7', @@global.gtid_executed)
VALID_POS
#node-1 (independent master)
update t set c = 'kkkkk' where i = 1;
update t set c = 'k2', i = 100 where i = 1;
select * from t;
i	c
3	cccccc
4	zzzzzz
50	pppppp
100	k2
1000	aaaaaa
2000	bbbbbb
select locate(':1-9', @@global.gtid_executed);
locate(':1-9', @@global.gtid_executed)
VALID_POS
#node-3 (galera-cluster-node-2 that act as master to independent slave)
select * from t;
i	c
3	cccccc
4	zzzzzz
50	pppppp
100	k2
1000	aaaaaa
2000	bbbbbb
select locate(':1-9', @@global.gtid_executed);
locate(':1-9', @@global.gtid_executed)
VALID_POS
#node-1 (independent master)
DROP TABLE t;
#node-2 (galera-cluster-node acting as slave to an independent master)
STOP SLAVE;
Warnings:
Warning	1287	'STOP SLAVE' is deprecated and will be removed in a future release. Please use STOP REPLICA instead
RESET SLAVE ALL;
Warnings:
Warning	1287	'RESET SLAVE' is deprecated and will be removed in a future release. Please use RESET REPLICA instead
#node-1 (independent master)
set session wsrep_on=off;
RESET MASTER;
set session wsrep_on=on;
#node-4 (independent slave replicating from galera-node-2)
STOP SLAVE;
Warnings:
Warning	1287	'STOP SLAVE' is deprecated and will be removed in a future release. Please use STOP REPLICA instead
RESET SLAVE ALL;
Warnings:
Warning	1287	'RESET SLAVE' is deprecated and will be removed in a future release. Please use RESET REPLICA instead
#node-3 (galera-cluster-node-2 that act as master to independent slave)
set session wsrep_on=off;
RESET MASTER;
set session wsrep_on=on;
