SET SESSION wsrep_sync_wait=0;
SET SESSION wsrep_sync_wait=0;
######################################################################
# Test for OPTIMIZE 
######################################################################
######################################################################
#
# Scenario #1: DML working on FK parent table BF aborted by DDL
#              over child table
#
######################################################################
SET SESSION wsrep_sync_wait=0;
CREATE TABLE p1 (pk INTEGER PRIMARY KEY, f2 CHAR(30));
INSERT INTO p1 VALUES (1, 'INITIAL VALUE');
CREATE TABLE p2 (pk INTEGER PRIMARY KEY, f2 CHAR(30));
INSERT INTO p2 VALUES (1, 'INITIAL VALUE');
INSERT INTO p2 VALUES (2, 'INITIAL VALUE');
CREATE TABLE c1 (pk INTEGER PRIMARY KEY, fk INTEGER, FOREIGN KEY (fk) REFERENCES p1(pk));
INSERT INTO c1 VALUES (1,1);
CREATE TABLE c2 (pk INTEGER PRIMARY KEY, fk1 INTEGER, fk2 INTEGER, FOREIGN KEY (fk1) REFERENCES p1(pk), FOREIGN KEY (fk2) REFERENCES p2(pk));
INSERT INTO c2 VALUES (1,1,1), (2,1,2);
SET AUTOCOMMIT=ON;
START TRANSACTION;
UPDATE p1 SET f2 = 'TO DEADLOCK' WHERE pk = 1;
SET SESSION wsrep_sync_wait=0;
OPTIMIZE TABLE c1 ;
Table	Op	Msg_type	Msg_text
test.c1	optimize	note	Table does not support optimize, doing recreate + analyze instead
test.c1	optimize	status	OK
COMMIT;
ERROR 40001: Deadlock found when trying to get lock; try restarting transaction
SELECT COUNT(*) AS EXPECT_1 FROM p1 WHERE f2 = 'INITIAL VALUE';
EXPECT_1
1
SELECT COUNT(*) AS EXPECT_2 FROM p2 WHERE f2 = 'INITIAL VALUE';
EXPECT_2
2
SELECT COUNT(*) AS EXPECT_1 FROM p1 WHERE f2 = 'INITIAL VALUE';
EXPECT_1
1
SELECT COUNT(*) AS EXPECT_2 FROM p2 WHERE f2 = 'INITIAL VALUE';
EXPECT_2
2
######################################################################
#
# Scenario #2: DML working on FK parent table tries to replicate, but
#              fails in certification for earlier DDL on child table
#
######################################################################
BEGIN;
SET GLOBAL wsrep_provider_options = 'dbug=d,apply_monitor_slave_enter_sync';
OPTIMIZE TABLE c1 ;
Table	Op	Msg_type	Msg_text
test.c1	optimize	note	Table does not support optimize, doing recreate + analyze instead
test.c1	optimize	status	OK
SET SESSION wsrep_on = 0;
SET SESSION wsrep_on = 1;
SET GLOBAL wsrep_provider_options = 'dbug=';
UPDATE p1 SET f2 = 'TO DEADLOCK' WHERE pk = 1;
COMMIT;
SET GLOBAL wsrep_provider_options = 'signal=apply_monitor_slave_enter_sync';
ERROR 40001: Deadlock found when trying to get lock; try restarting transaction
SELECT 'I deadlocked';
I deadlocked
I deadlocked
SELECT COUNT(*) AS EXPECT_1 FROM p1 WHERE f2 = 'INITIAL VALUE';
EXPECT_1
1
SELECT COUNT(*) AS EXPECT_2 FROM p2 WHERE f2 = 'INITIAL VALUE';
EXPECT_2
2
SELECT COUNT(*) AS EXPECT_1 FROM p1 WHERE f2 = 'INITIAL VALUE';
EXPECT_1
1
SELECT COUNT(*) AS EXPECT_2 FROM p2 WHERE f2 = 'INITIAL VALUE';
EXPECT_2
2
######################################################################
#
# Scenario #3: 2 DMLs working on two FK parent tables try to replicate,
#              but fails in certification for earlier DDL on child table
#              which is child to both FK parents
#
######################################################################
BEGIN;
BEGIN;
SET GLOBAL wsrep_provider_options = 'dbug=d,apply_monitor_slave_enter_sync';
OPTIMIZE TABLE c2 ;
Table	Op	Msg_type	Msg_text
test.c2	optimize	note	Table does not support optimize, doing recreate + analyze instead
test.c2	optimize	status	OK
SET SESSION wsrep_on = 0;
SET SESSION wsrep_on = 1;
SET GLOBAL wsrep_provider_options = 'dbug=';
UPDATE p1 SET f2 = 'TO DEADLOCK' WHERE pk = 1;
COMMIT;
UPDATE p2 SET f2 = 'TO DEADLOCK' WHERE pk = 2;
COMMIT;
SET GLOBAL wsrep_provider_options = 'signal=apply_monitor_slave_enter_sync';
ERROR 40001: Deadlock found when trying to get lock; try restarting transaction
SELECT 'I deadlocked';
I deadlocked
I deadlocked
ERROR 40001: Deadlock found when trying to get lock; try restarting transaction
SELECT 'I deadlocked';
I deadlocked
I deadlocked
SELECT COUNT(*) AS EXPECT_1 FROM p1 WHERE f2 = 'INITIAL VALUE';
EXPECT_1
1
SELECT COUNT(*) AS EXPECT_2 FROM p2 WHERE f2 = 'INITIAL VALUE';
EXPECT_2
2
SELECT COUNT(*) AS EXPECT_1 FROM p1 WHERE f2 = 'INITIAL VALUE';
EXPECT_1
1
SELECT COUNT(*) AS EXPECT_2 FROM p2 WHERE f2 = 'INITIAL VALUE';
EXPECT_2
2
DROP TABLE c1, c2;
DROP TABLE p1, p2;
######################################################################
# Test for OPTIMIZE 
######################################################################
SET SESSION wsrep_sync_wait=0;
CREATE TABLE p1 (pk INTEGER PRIMARY KEY, f2 CHAR(30));
INSERT INTO p1 VALUES (1, 'INITIAL VALUE');
CREATE TABLE c1 (pk INTEGER PRIMARY KEY, fk INTEGER, FOREIGN KEY (fk) REFERENCES p1(pk));
INSERT INTO c1 VALUES (1,1);
######################################################################
#
# Scenario #4: DML working on FK parent table tries to replicate, but
#              fails in certification for earlier DDL on child table
#              and another temporary table. TMP table should be skipped
#              but FK child table should be replicated with proper keys
#
######################################################################
BEGIN;
SET GLOBAL wsrep_provider_options = 'dbug=d,apply_monitor_slave_enter_sync';
CREATE TEMPORARY TABLE tmp (i int);
OPTIMIZE TABLE c1, tmp ;
Table	Op	Msg_type	Msg_text
test.c1	optimize	note	Table does not support optimize, doing recreate + analyze instead
test.c1	optimize	status	OK
test.tmp	optimize	note	Table does not support optimize, doing recreate + analyze instead
test.tmp	optimize	status	OK
DROP TABLE tmp;
SET SESSION wsrep_on = 0;
SET SESSION wsrep_on = 1;
SET GLOBAL wsrep_provider_options = 'dbug=';
UPDATE p1 SET f2 = 'TO DEADLOCK' WHERE pk = 1;
COMMIT;
SET GLOBAL wsrep_provider_options = 'signal=apply_monitor_slave_enter_sync';
ERROR 40001: Deadlock found when trying to get lock; try restarting transaction
SELECT 'I deadlocked';
I deadlocked
I deadlocked
SELECT COUNT(*) AS EXPECT_1 FROM p1 WHERE f2 = 'INITIAL VALUE';
EXPECT_1
1
SELECT COUNT(*) AS EXPECT_1 FROM p1 WHERE f2 = 'INITIAL VALUE';
EXPECT_1
1
DROP TABLE c1;
DROP TABLE p1;
######################################################################
# Test for REPAIR 
######################################################################
######################################################################
#
# Scenario #1: DML working on FK parent table BF aborted by DDL
#              over child table
#
######################################################################
SET SESSION wsrep_sync_wait=0;
CREATE TABLE p1 (pk INTEGER PRIMARY KEY, f2 CHAR(30));
INSERT INTO p1 VALUES (1, 'INITIAL VALUE');
CREATE TABLE p2 (pk INTEGER PRIMARY KEY, f2 CHAR(30));
INSERT INTO p2 VALUES (1, 'INITIAL VALUE');
INSERT INTO p2 VALUES (2, 'INITIAL VALUE');
CREATE TABLE c1 (pk INTEGER PRIMARY KEY, fk INTEGER, FOREIGN KEY (fk) REFERENCES p1(pk));
INSERT INTO c1 VALUES (1,1);
CREATE TABLE c2 (pk INTEGER PRIMARY KEY, fk1 INTEGER, fk2 INTEGER, FOREIGN KEY (fk1) REFERENCES p1(pk), FOREIGN KEY (fk2) REFERENCES p2(pk));
INSERT INTO c2 VALUES (1,1,1), (2,1,2);
SET AUTOCOMMIT=ON;
START TRANSACTION;
UPDATE p1 SET f2 = 'TO DEADLOCK' WHERE pk = 1;
SET SESSION wsrep_sync_wait=0;
REPAIR TABLE c1 ;
Table	Op	Msg_type	Msg_text
test.c1	repair	note	The storage engine for the table doesn't support repair
COMMIT;
ERROR 40001: Deadlock found when trying to get lock; try restarting transaction
SELECT COUNT(*) AS EXPECT_1 FROM p1 WHERE f2 = 'INITIAL VALUE';
EXPECT_1
1
SELECT COUNT(*) AS EXPECT_2 FROM p2 WHERE f2 = 'INITIAL VALUE';
EXPECT_2
2
SELECT COUNT(*) AS EXPECT_1 FROM p1 WHERE f2 = 'INITIAL VALUE';
EXPECT_1
1
SELECT COUNT(*) AS EXPECT_2 FROM p2 WHERE f2 = 'INITIAL VALUE';
EXPECT_2
2
######################################################################
#
# Scenario #2: DML working on FK parent table tries to replicate, but
#              fails in certification for earlier DDL on child table
#
######################################################################
BEGIN;
SET GLOBAL wsrep_provider_options = 'dbug=d,apply_monitor_slave_enter_sync';
REPAIR TABLE c1 ;
Table	Op	Msg_type	Msg_text
test.c1	repair	note	The storage engine for the table doesn't support repair
SET SESSION wsrep_on = 0;
SET SESSION wsrep_on = 1;
SET GLOBAL wsrep_provider_options = 'dbug=';
UPDATE p1 SET f2 = 'TO DEADLOCK' WHERE pk = 1;
COMMIT;
SET GLOBAL wsrep_provider_options = 'signal=apply_monitor_slave_enter_sync';
ERROR 40001: Deadlock found when trying to get lock; try restarting transaction
SELECT 'I deadlocked';
I deadlocked
I deadlocked
SELECT COUNT(*) AS EXPECT_1 FROM p1 WHERE f2 = 'INITIAL VALUE';
EXPECT_1
1
SELECT COUNT(*) AS EXPECT_2 FROM p2 WHERE f2 = 'INITIAL VALUE';
EXPECT_2
2
SELECT COUNT(*) AS EXPECT_1 FROM p1 WHERE f2 = 'INITIAL VALUE';
EXPECT_1
1
SELECT COUNT(*) AS EXPECT_2 FROM p2 WHERE f2 = 'INITIAL VALUE';
EXPECT_2
2
######################################################################
#
# Scenario #3: 2 DMLs working on two FK parent tables try to replicate,
#              but fails in certification for earlier DDL on child table
#              which is child to both FK parents
#
######################################################################
BEGIN;
BEGIN;
SET GLOBAL wsrep_provider_options = 'dbug=d,apply_monitor_slave_enter_sync';
REPAIR TABLE c2 ;
Table	Op	Msg_type	Msg_text
test.c2	repair	note	The storage engine for the table doesn't support repair
SET SESSION wsrep_on = 0;
SET SESSION wsrep_on = 1;
SET GLOBAL wsrep_provider_options = 'dbug=';
UPDATE p1 SET f2 = 'TO DEADLOCK' WHERE pk = 1;
COMMIT;
UPDATE p2 SET f2 = 'TO DEADLOCK' WHERE pk = 2;
COMMIT;
SET GLOBAL wsrep_provider_options = 'signal=apply_monitor_slave_enter_sync';
ERROR 40001: Deadlock found when trying to get lock; try restarting transaction
SELECT 'I deadlocked';
I deadlocked
I deadlocked
ERROR 40001: Deadlock found when trying to get lock; try restarting transaction
SELECT 'I deadlocked';
I deadlocked
I deadlocked
SELECT COUNT(*) AS EXPECT_1 FROM p1 WHERE f2 = 'INITIAL VALUE';
EXPECT_1
1
SELECT COUNT(*) AS EXPECT_2 FROM p2 WHERE f2 = 'INITIAL VALUE';
EXPECT_2
2
SELECT COUNT(*) AS EXPECT_1 FROM p1 WHERE f2 = 'INITIAL VALUE';
EXPECT_1
1
SELECT COUNT(*) AS EXPECT_2 FROM p2 WHERE f2 = 'INITIAL VALUE';
EXPECT_2
2
DROP TABLE c1, c2;
DROP TABLE p1, p2;
######################################################################
# Test for REPAIR 
######################################################################
SET SESSION wsrep_sync_wait=0;
CREATE TABLE p1 (pk INTEGER PRIMARY KEY, f2 CHAR(30));
INSERT INTO p1 VALUES (1, 'INITIAL VALUE');
CREATE TABLE c1 (pk INTEGER PRIMARY KEY, fk INTEGER, FOREIGN KEY (fk) REFERENCES p1(pk));
INSERT INTO c1 VALUES (1,1);
######################################################################
#
# Scenario #4: DML working on FK parent table tries to replicate, but
#              fails in certification for earlier DDL on child table
#              and another temporary table. TMP table should be skipped
#              but FK child table should be replicated with proper keys
#
######################################################################
BEGIN;
SET GLOBAL wsrep_provider_options = 'dbug=d,apply_monitor_slave_enter_sync';
CREATE TEMPORARY TABLE tmp (i int);
REPAIR TABLE c1, tmp ;
Table	Op	Msg_type	Msg_text
test.c1	repair	note	The storage engine for the table doesn't support repair
test.tmp	repair	note	The storage engine for the table doesn't support repair
DROP TABLE tmp;
SET SESSION wsrep_on = 0;
SET SESSION wsrep_on = 1;
SET GLOBAL wsrep_provider_options = 'dbug=';
UPDATE p1 SET f2 = 'TO DEADLOCK' WHERE pk = 1;
COMMIT;
SET GLOBAL wsrep_provider_options = 'signal=apply_monitor_slave_enter_sync';
ERROR 40001: Deadlock found when trying to get lock; try restarting transaction
SELECT 'I deadlocked';
I deadlocked
I deadlocked
SELECT COUNT(*) AS EXPECT_1 FROM p1 WHERE f2 = 'INITIAL VALUE';
EXPECT_1
1
SELECT COUNT(*) AS EXPECT_1 FROM p1 WHERE f2 = 'INITIAL VALUE';
EXPECT_1
1
DROP TABLE c1;
DROP TABLE p1;
######################################################################
# Test for ALTER ENGINE=INNODB
######################################################################
######################################################################
#
# Scenario #1: DML working on FK parent table BF aborted by DDL
#              over child table
#
######################################################################
SET SESSION wsrep_sync_wait=0;
CREATE TABLE p1 (pk INTEGER PRIMARY KEY, f2 CHAR(30));
INSERT INTO p1 VALUES (1, 'INITIAL VALUE');
CREATE TABLE p2 (pk INTEGER PRIMARY KEY, f2 CHAR(30));
INSERT INTO p2 VALUES (1, 'INITIAL VALUE');
INSERT INTO p2 VALUES (2, 'INITIAL VALUE');
CREATE TABLE c1 (pk INTEGER PRIMARY KEY, fk INTEGER, FOREIGN KEY (fk) REFERENCES p1(pk));
INSERT INTO c1 VALUES (1,1);
CREATE TABLE c2 (pk INTEGER PRIMARY KEY, fk1 INTEGER, fk2 INTEGER, FOREIGN KEY (fk1) REFERENCES p1(pk), FOREIGN KEY (fk2) REFERENCES p2(pk));
INSERT INTO c2 VALUES (1,1,1), (2,1,2);
SET AUTOCOMMIT=ON;
START TRANSACTION;
UPDATE p1 SET f2 = 'TO DEADLOCK' WHERE pk = 1;
SET SESSION wsrep_sync_wait=0;
ALTER TABLE c1 ENGINE=INNODB;
COMMIT;
ERROR 40001: Deadlock found when trying to get lock; try restarting transaction
SELECT COUNT(*) AS EXPECT_1 FROM p1 WHERE f2 = 'INITIAL VALUE';
EXPECT_1
1
SELECT COUNT(*) AS EXPECT_2 FROM p2 WHERE f2 = 'INITIAL VALUE';
EXPECT_2
2
SELECT COUNT(*) AS EXPECT_1 FROM p1 WHERE f2 = 'INITIAL VALUE';
EXPECT_1
1
SELECT COUNT(*) AS EXPECT_2 FROM p2 WHERE f2 = 'INITIAL VALUE';
EXPECT_2
2
######################################################################
#
# Scenario #2: DML working on FK parent table tries to replicate, but
#              fails in certification for earlier DDL on child table
#
######################################################################
BEGIN;
SET GLOBAL wsrep_provider_options = 'dbug=d,apply_monitor_slave_enter_sync';
ALTER TABLE c1 ENGINE=INNODB;
SET SESSION wsrep_on = 0;
SET SESSION wsrep_on = 1;
SET GLOBAL wsrep_provider_options = 'dbug=';
UPDATE p1 SET f2 = 'TO DEADLOCK' WHERE pk = 1;
COMMIT;
SET GLOBAL wsrep_provider_options = 'signal=apply_monitor_slave_enter_sync';
ERROR 40001: Deadlock found when trying to get lock; try restarting transaction
SELECT 'I deadlocked';
I deadlocked
I deadlocked
SELECT COUNT(*) AS EXPECT_1 FROM p1 WHERE f2 = 'INITIAL VALUE';
EXPECT_1
1
SELECT COUNT(*) AS EXPECT_2 FROM p2 WHERE f2 = 'INITIAL VALUE';
EXPECT_2
2
SELECT COUNT(*) AS EXPECT_1 FROM p1 WHERE f2 = 'INITIAL VALUE';
EXPECT_1
1
SELECT COUNT(*) AS EXPECT_2 FROM p2 WHERE f2 = 'INITIAL VALUE';
EXPECT_2
2
######################################################################
#
# Scenario #3: 2 DMLs working on two FK parent tables try to replicate,
#              but fails in certification for earlier DDL on child table
#              which is child to both FK parents
#
######################################################################
BEGIN;
BEGIN;
SET GLOBAL wsrep_provider_options = 'dbug=d,apply_monitor_slave_enter_sync';
ALTER TABLE c2 ENGINE=INNODB;
SET SESSION wsrep_on = 0;
SET SESSION wsrep_on = 1;
SET GLOBAL wsrep_provider_options = 'dbug=';
UPDATE p1 SET f2 = 'TO DEADLOCK' WHERE pk = 1;
COMMIT;
UPDATE p2 SET f2 = 'TO DEADLOCK' WHERE pk = 2;
COMMIT;
SET GLOBAL wsrep_provider_options = 'signal=apply_monitor_slave_enter_sync';
ERROR 40001: Deadlock found when trying to get lock; try restarting transaction
SELECT 'I deadlocked';
I deadlocked
I deadlocked
ERROR 40001: Deadlock found when trying to get lock; try restarting transaction
SELECT 'I deadlocked';
I deadlocked
I deadlocked
SELECT COUNT(*) AS EXPECT_1 FROM p1 WHERE f2 = 'INITIAL VALUE';
EXPECT_1
1
SELECT COUNT(*) AS EXPECT_2 FROM p2 WHERE f2 = 'INITIAL VALUE';
EXPECT_2
2
SELECT COUNT(*) AS EXPECT_1 FROM p1 WHERE f2 = 'INITIAL VALUE';
EXPECT_1
1
SELECT COUNT(*) AS EXPECT_2 FROM p2 WHERE f2 = 'INITIAL VALUE';
EXPECT_2
2
DROP TABLE c1, c2;
DROP TABLE p1, p2;
######################################################################
# Test for TRUNCATE 
######################################################################
######################################################################
#
# Scenario #1: DML working on FK parent table BF aborted by DDL
#              over child table
#
######################################################################
SET SESSION wsrep_sync_wait=0;
CREATE TABLE p1 (pk INTEGER PRIMARY KEY, f2 CHAR(30));
INSERT INTO p1 VALUES (1, 'INITIAL VALUE');
CREATE TABLE p2 (pk INTEGER PRIMARY KEY, f2 CHAR(30));
INSERT INTO p2 VALUES (1, 'INITIAL VALUE');
INSERT INTO p2 VALUES (2, 'INITIAL VALUE');
CREATE TABLE c1 (pk INTEGER PRIMARY KEY, fk INTEGER, FOREIGN KEY (fk) REFERENCES p1(pk));
INSERT INTO c1 VALUES (1,1);
CREATE TABLE c2 (pk INTEGER PRIMARY KEY, fk1 INTEGER, fk2 INTEGER, FOREIGN KEY (fk1) REFERENCES p1(pk), FOREIGN KEY (fk2) REFERENCES p2(pk));
INSERT INTO c2 VALUES (1,1,1), (2,1,2);
SET AUTOCOMMIT=ON;
START TRANSACTION;
UPDATE p1 SET f2 = 'TO DEADLOCK' WHERE pk = 1;
SET SESSION wsrep_sync_wait=0;
TRUNCATE TABLE c1 ;
COMMIT;
ERROR 40001: Deadlock found when trying to get lock; try restarting transaction
SELECT COUNT(*) AS EXPECT_1 FROM p1 WHERE f2 = 'INITIAL VALUE';
EXPECT_1
1
SELECT COUNT(*) AS EXPECT_2 FROM p2 WHERE f2 = 'INITIAL VALUE';
EXPECT_2
2
SELECT COUNT(*) AS EXPECT_1 FROM p1 WHERE f2 = 'INITIAL VALUE';
EXPECT_1
1
SELECT COUNT(*) AS EXPECT_2 FROM p2 WHERE f2 = 'INITIAL VALUE';
EXPECT_2
2
######################################################################
#
# Scenario #2: DML working on FK parent table tries to replicate, but
#              fails in certification for earlier DDL on child table
#
######################################################################
BEGIN;
SET GLOBAL wsrep_provider_options = 'dbug=d,apply_monitor_slave_enter_sync';
TRUNCATE TABLE c1 ;
SET SESSION wsrep_on = 0;
SET SESSION wsrep_on = 1;
SET GLOBAL wsrep_provider_options = 'dbug=';
UPDATE p1 SET f2 = 'TO DEADLOCK' WHERE pk = 1;
COMMIT;
SET GLOBAL wsrep_provider_options = 'signal=apply_monitor_slave_enter_sync';
ERROR 40001: Deadlock found when trying to get lock; try restarting transaction
SELECT 'I deadlocked';
I deadlocked
I deadlocked
SELECT COUNT(*) AS EXPECT_1 FROM p1 WHERE f2 = 'INITIAL VALUE';
EXPECT_1
1
SELECT COUNT(*) AS EXPECT_2 FROM p2 WHERE f2 = 'INITIAL VALUE';
EXPECT_2
2
SELECT COUNT(*) AS EXPECT_1 FROM p1 WHERE f2 = 'INITIAL VALUE';
EXPECT_1
1
SELECT COUNT(*) AS EXPECT_2 FROM p2 WHERE f2 = 'INITIAL VALUE';
EXPECT_2
2
######################################################################
#
# Scenario #3: 2 DMLs working on two FK parent tables try to replicate,
#              but fails in certification for earlier DDL on child table
#              which is child to both FK parents
#
######################################################################
BEGIN;
BEGIN;
SET GLOBAL wsrep_provider_options = 'dbug=d,apply_monitor_slave_enter_sync';
TRUNCATE TABLE c2 ;
SET SESSION wsrep_on = 0;
SET SESSION wsrep_on = 1;
SET GLOBAL wsrep_provider_options = 'dbug=';
UPDATE p1 SET f2 = 'TO DEADLOCK' WHERE pk = 1;
COMMIT;
UPDATE p2 SET f2 = 'TO DEADLOCK' WHERE pk = 2;
COMMIT;
SET GLOBAL wsrep_provider_options = 'signal=apply_monitor_slave_enter_sync';
ERROR 40001: Deadlock found when trying to get lock; try restarting transaction
SELECT 'I deadlocked';
I deadlocked
I deadlocked
ERROR 40001: Deadlock found when trying to get lock; try restarting transaction
SELECT 'I deadlocked';
I deadlocked
I deadlocked
SELECT COUNT(*) AS EXPECT_1 FROM p1 WHERE f2 = 'INITIAL VALUE';
EXPECT_1
1
SELECT COUNT(*) AS EXPECT_2 FROM p2 WHERE f2 = 'INITIAL VALUE';
EXPECT_2
2
SELECT COUNT(*) AS EXPECT_1 FROM p1 WHERE f2 = 'INITIAL VALUE';
EXPECT_1
1
SELECT COUNT(*) AS EXPECT_2 FROM p2 WHERE f2 = 'INITIAL VALUE';
EXPECT_2
2
DROP TABLE c1, c2;
DROP TABLE p1, p2;
