CREATE TABLE t1 (f1 INTEGER PRIMARY KEY, f2 INT) ENGINE=InnoDB;
INSERT INTO t1 VALUES (1, 10);
BEGIN;
SELECT * FROM t1 FOR UPDATE;
f1	f2
1	10
UPDATE t1 SET f1 = 2;
COMMIT;
ERROR 40001: WSREP detected deadlock/conflict and aborted the transaction. Try restarting the transaction
wsrep_local_bf_aborts_diff
1
BEGIN;
SELECT * FROM t1 FOR UPDATE;
f1	f2
2	10
UPDATE t1 SET f2 = 20;
COMMIT;
ERROR 40001: WSREP detected deadlock/conflict and aborted the transaction. Try restarting the transaction
wsrep_local_bf_aborts_diff
1
DROP TABLE t1;
