CREATE SCHEMA S;
CREATE TABLE S.t1(i INT, j INT, INDEX i1(i));
ALTER SCHEMA S read only=1;
SHOW CREATE SCHEMA S;
Database	Create Database
S	CREATE DATABASE `S` /*!40100 DEFAULT CHARACTER SET utf8mb4 COLLATE utf8mb4_0900_ai_ci */ /*!80016 DEFAULT ENCRYPTION='N' */ /* READ ONLY = 1 */
ALTER SCHEMA S read only=0;
DROP SCHEMA S;
#--------------------------------------------------------------------
# Invalid option in CREATE SCHEMA.
#--------------------------------------------------------------------
CREATE SCHEMA S read only=0;
ERROR 42000: You have an error in your SQL syntax; check the manual that corresponds to your MySQL server version for the right syntax to use near 'read only=0' at line 1
#--------------------------------------------------------------------
# ALTER privilege needed to change read only.
#--------------------------------------------------------------------
CREATE SCHEMA S;
CREATE USER s_usr;
ALTER SCHEMA S read only=1;
ERROR 42000: Access denied for user 's_usr'@'%' to database 'S'
GRANT ALTER ON S.* TO s_usr;
ALTER SCHEMA S read only=1;
ALTER SCHEMA S read only=0;
DROP USER s_usr;
DROP SCHEMA S;
#--------------------------------------------------------------------
# The read only option affects all users.
#--------------------------------------------------------------------
CREATE USER con_adm_usr;
GRANT ALL ON *.* TO con_adm_usr;
GRANT CONNECTION_ADMIN ON *.* TO con_adm_usr;
CREATE USER super_usr;
GRANT ALL ON *.* TO super_usr;
GRANT SUPER ON *.* TO super_usr;
Warnings:
Warning	1287	The SUPER privilege identifier is deprecated
CREATE SCHEMA S;
CREATE TABLE S.t(i INT);
DROP TABLE S.t;
ALTER SCHEMA S READ ONLY=1;
CREATE TABLE S.t(i INT);
ERROR HY000: Schema 'S' is in read only mode.
ALTER SCHEMA S READ ONLY=0;
CREATE TABLE S.t(i INT);
DROP TABLE S.t;
ALTER SCHEMA S READ ONLY=1;
CREATE TABLE S.t(i INT);
ERROR HY000: Schema 'S' is in read only mode.
ALTER SCHEMA S READ ONLY=0;
CREATE TABLE S.t(i INT);
DROP TABLE S.t;
ALTER SCHEMA S READ ONLY=1;
CREATE TABLE S.t(i INT);
ERROR HY000: Schema 'S' is in read only mode.
ALTER SCHEMA S READ ONLY=0;
DROP USER con_adm_usr;
DROP USER super_usr;
DROP SCHEMA S;
#--------------------------------------------------------------------
# Statements in an init file shall not be affected.
#--------------------------------------------------------------------
CREATE SCHEMA S;
# restart: --init-file=MYSQLTEST_VARDIR/tmp/schema_read_only.sql
SHOW CREATE SCHEMA schema_read_only;
ERROR 42000: Unknown database 'schema_read_only'
SHOW TABLES IN S;
Tables_in_S
init_file
SHOW CREATE SCHEMA S;
Database	Create Database
S	CREATE DATABASE `S` /*!40100 DEFAULT CHARACTER SET utf8mb4 COLLATE utf8mb4_0900_ai_ci */ /*!80016 DEFAULT ENCRYPTION='N' */
ALTER SCHEMA S READ ONLY=0;
DROP SCHEMA S;
#--------------------------------------------------------------------
# No ALTER for mysql, I_S, P_S and sys.
#--------------------------------------------------------------------
ALTER SCHEMA mysql READ ONLY=1;
ERROR HY000: Access to system schema 'mysql' is rejected.
ALTER SCHEMA information_schema READ ONLY=1;
ERROR 42000: Access denied for user 'root'@'localhost' to database 'information_schema'
ALTER SCHEMA performance_schema READ ONLY=1;
ERROR 42000: Access denied for user 'root'@'localhost' to database 'performance_schema'
CREATE SCHEMA S;
CREATE TABLE S.t1(i INT, j INT, INDEX i1(i));
ALTER SCHEMA S READ ONLY = 1;
#--------------------------------------------------------------------
# Schema operations.
#--------------------------------------------------------------------
CREATE SCHEMA S;
ERROR HY000: Can't create database 'S'; database exists
ALTER SCHEMA S COLLATE utf8mb4_bin;
ERROR HY000: Schema 'S' is in read only mode.
ALTER SCHEMA S CHARACTER SET ascii;
ERROR HY000: Schema 'S' is in read only mode.
DROP SCHEMA S;
ERROR HY000: Schema 'S' is in read only mode.
#--------------------------------------------------------------------
# Table operations.
#--------------------------------------------------------------------
CREATE TABLE S.t2(i INT);
ERROR HY000: Schema 'S' is in read only mode.
ALTER TABLE S.t1 ADD COLUMN (k INT), ALGORITHM INSTANT;
ERROR HY000: Schema 'S' is in read only mode.
ALTER TABLE S.t1 ADD COLUMN (k INT), ALGORITHM INPLACE;
ERROR HY000: Schema 'S' is in read only mode.
ALTER TABLE S.t1 ADD COLUMN (k INT), ALGORITHM COPY;
ERROR HY000: Schema 'S' is in read only mode.
CREATE INDEX i2 ON S.t1(j);
ERROR HY000: Schema 'S' is in read only mode.
DROP INDEX i1 ON S.t1;
ERROR HY000: Schema 'S' is in read only mode.
RENAME TABLE S.t1 TO S.t2;
ERROR HY000: Schema 'S' is in read only mode.
CREATE TABLE test.t1 LIKE S.t1;
RENAME TABLE S.t1 TO S.t2;
ERROR HY000: Schema 'S' is in read only mode.
RENAME TABLE test.t1 TO test.t2, S.t1 TO S.t2;
ERROR HY000: Schema 'S' is in read only mode.
TRUNCATE TABLE S.t1;
ERROR HY000: Schema 'S' is in read only mode.
DROP TABLE S.t1;
ERROR HY000: Schema 'S' is in read only mode.
DROP TABLE test.t1, S.t1;
ERROR HY000: Schema 'S' is in read only mode.
DROP TABLE test.t1;
SELECT * FROM S.t1;
i	j
DELETE FROM S.t1;
ERROR HY000: Schema 'S' is in read only mode.
INSERT INTO S.t1 VALUES (1, 1);
ERROR HY000: Schema 'S' is in read only mode.
REPLACE INTO S.t1 VALUES (1, 1);
ERROR HY000: Schema 'S' is in read only mode.
UPDATE S.t1 SET i = j;
ERROR HY000: Schema 'S' is in read only mode.
#--------------------------------------------------------------------
# Import
#--------------------------------------------------------------------
ALTER SCHEMA S READ ONLY=0;
CREATE TABLE S.t_imp (i INT) ENGINE=MYISAM;
INSERT INTO S.t_imp VALUES (1), (3), (5);
SELECT * FROM S.t_imp;
i
1
3
5
FLUSH TABLES WITH READ LOCK;
UNLOCK TABLES;
DROP TABLE S.t_imp;
ALTER SCHEMA S READ ONLY=1;
USE S;
IMPORT TABLE FROM 't_imp*.sdi';
ERROR HY000: Schema 'S' is in read only mode.
#--------------------------------------------------------------------
# LOAD DATA INFILE/XML
#--------------------------------------------------------------------
SELECT 1, 1 INTO OUTFILE 't.txt';
LOAD DATA INFILE 't.txt' INTO TABLE S.t1;
ERROR HY000: Schema 'S' is in read only mode.
CREATE TABLE test.t1 LIKE S.t1;
INSERT INTO test.t1 VALUES (1, 1);
LOAD XML INFILE "MYSQLTEST_VARDIR/tmp/t1.xml" INTO TABLE S.t1;;
ERROR HY000: Schema 'S' is in read only mode.
#--------------------------------------------------------------------
# View operations.
#--------------------------------------------------------------------
CREATE VIEW S.v1 AS SELECT * FROM S.t1;
ERROR HY000: Schema 'S' is in read only mode.
ALTER SCHEMA S READ ONLY=0;
CREATE VIEW S.v1 AS SELECT * FROM test.t1;
ALTER SCHEMA S READ ONLY=1;
# Operations altering the validity of a view in a read only schema are
# rejected.
DROP TABLE test.t1;
ERROR HY000: Schema 'S' is in read only mode.
DROP DATABASE test;
ERROR HY000: Schema 'S' is in read only mode.
ALTER SCHEMA S READ ONLY=0;
DROP TABLE test.t1;
ALTER SCHEMA S READ ONLY=1;
CREATE TABLE test.t1 LIKE S.t1;
ERROR HY000: Schema 'S' is in read only mode.
ALTER VIEW S.v1 AS SELECT * FROM S.t1;
ERROR HY000: Schema 'S' is in read only mode.
DROP VIEW S.v1;
ERROR HY000: Schema 'S' is in read only mode.
ALTER SCHEMA S READ ONLY=0;
DROP VIEW S.v1;
ALTER SCHEMA S READ ONLY=1;
# Inserts in updatable view will fail.
CREATE VIEW test.v AS SELECT * FROM S.t1;
SELECT * FROM test.v;
i	j
INSERT INTO test.v VALUES(1, 1);
ERROR HY000: Schema 'S' is in read only mode.
DROP VIEW test.v;
#--------------------------------------------------------------------
# Functions. Recursion not allowed, DDL causing implicit commit not
# allowed.
#--------------------------------------------------------------------
CREATE FUNCTION S.f() RETURNS INT RETURN 1;
ERROR HY000: Schema 'S' is in read only mode.
CREATE TABLE test.t1 LIKE S.t1;
ALTER SCHEMA S READ ONLY=0;
CREATE FUNCTION S.f(stmt VARCHAR(20)) RETURNS INT
BEGIN
CASE stmt
WHEN 'INSERT s' THEN INSERT INTO S.t1 VALUES(1, 1);
WHEN 'INSERT test' THEN INSERT INTO test.t1 VALUES(1, 1);
ELSE BEGIN END;
END CASE;
RETURN 1;
END|
CREATE VIEW S.v_s AS SELECT S.f('INSERT s');
CREATE VIEW S.v_test AS SELECT S.f('INSERT test');
ALTER SCHEMA S READ ONLY=1;
CREATE FUNCTION test.f(stmt VARCHAR(20)) RETURNS INT
BEGIN
CASE stmt
WHEN 'INSERT s' THEN INSERT INTO S.t1 VALUES(1, 1);
WHEN 'INSERT test' THEN INSERT INTO test.t1 VALUES(1, 1);
ELSE BEGIN END;
END CASE;
RETURN 1;
END|
CREATE VIEW test.v_s AS SELECT test.f('INSERT s');
CREATE VIEW test.v_test AS SELECT test.f('INSERT test');
# Fails due to prelocking strategy.
SELECT S.f('INSERT test');
ERROR HY000: Schema 'S' is in read only mode.
SELECT S.f('INSERT s');
ERROR HY000: Schema 'S' is in read only mode.
SELECT * FROM S.v_test;
ERROR HY000: Schema 'S' is in read only mode.
SELECT * FROM S.v_s;
ERROR HY000: Schema 'S' is in read only mode.
DROP FUNCTION S.f;
ERROR HY000: Schema 'S' is in read only mode.
# Fails due to prelocking strategy.
SELECT test.f('INSERT test');
ERROR HY000: Schema 'S' is in read only mode.
SELECT test.f('INSERT s');
ERROR HY000: Schema 'S' is in read only mode.
SELECT * FROM test.v_test;
ERROR HY000: Schema 'S' is in read only mode.
SELECT * FROM test.v_s;
ERROR HY000: Schema 'S' is in read only mode.
ALTER SCHEMA S READ ONLY=0;
SELECT S.f('INSERT test');
S.f('INSERT test')
1
SELECT S.f('INSERT s');
S.f('INSERT s')
1
SELECT * FROM S.v_test;
S.f('INSERT test')
1
SELECT * FROM S.v_s;
S.f('INSERT s')
1
SELECT test.f('INSERT test');
test.f('INSERT test')
1
SELECT test.f('INSERT s');
test.f('INSERT s')
1
SELECT * FROM test.v_test;
test.f('INSERT test')
1
SELECT * FROM test.v_s;
test.f('INSERT s')
1
DROP VIEW S.v_s;
DROP VIEW S.v_test;
DROP FUNCTION S.f;
ALTER SCHEMA S READ ONLY=1;
DROP VIEW test.v_s;
DROP VIEW test.v_test;
DROP FUNCTION test.f;
DROP TABLE test.t1;
#--------------------------------------------------------------------
# Procedures.
#--------------------------------------------------------------------
CREATE PROCEDURE S.p() BEGIN END;
ERROR HY000: Schema 'S' is in read only mode.
CREATE TABLE test.t1 LIKE S.t1;
ALTER SCHEMA S READ ONLY=0;
CREATE PROCEDURE S.p(stmt VARCHAR(20))
BEGIN
CASE stmt
WHEN 'INSERT s' THEN INSERT INTO S.t1 VALUES(1, 1);
WHEN 'INSERT test' THEN INSERT INTO test.t1 VALUES(1, 1);
ELSE BEGIN END;
END CASE;
END|
ALTER SCHEMA S READ ONLY=1;
CREATE PROCEDURE test.p(stmt VARCHAR(20))
BEGIN
CASE stmt
WHEN 'INSERT s' THEN INSERT INTO S.t1 VALUES(1, 1);
WHEN 'INSERT test' THEN INSERT INTO test.t1 VALUES(1, 1);
ELSE BEGIN END;
END CASE;
END|
CALL S.p('INSERT s');
ERROR HY000: Schema 'S' is in read only mode.
# Succeeds due to no prelocking for CALL.
CALL S.p('INSERT test');
DROP PROCEDURE S.p;
ERROR HY000: Schema 'S' is in read only mode.
CALL test.p('INSERT s');
ERROR HY000: Schema 'S' is in read only mode.
# Succeeds due to no prelocking for CALL.
CALL test.p('INSERT test');
ALTER SCHEMA S READ ONLY=0;
CALL S.p('INSERT s');
CALL S.p('INSERT test');
DROP PROCEDURE S.p;
CALL test.p('INSERT s');
CALL test.p('INSERT test');
ALTER SCHEMA S READ ONLY=1;
DROP PROCEDURE test.p;
DROP TABLE test.t1;
#--------------------------------------------------------------------
# Triggers.
#--------------------------------------------------------------------
CREATE TABLE test.t1 LIKE S.t1;
CREATE TRIGGER S.eq BEFORE INSERT ON S.t1 FOR EACH ROW SET NEW.j = NEW.i;
ERROR HY000: Schema 'S' is in read only mode.
ALTER SCHEMA S READ ONLY=0;
CREATE TRIGGER S.ins_upd
BEFORE INSERT ON S.t1 FOR EACH ROW UPDATE test.t1 SET i = j;
ALTER SCHEMA S READ ONLY=1;
DROP TRIGGER S.ins_upd;
ERROR HY000: Schema 'S' is in read only mode.
CREATE TRIGGER test.ins_upd
BEFORE INSERT ON test.t1 FOR EACH ROW UPDATE S.t1 SET j = i;
INSERT INTO S.t1 VALUES (1, 2);
ERROR HY000: Schema 'S' is in read only mode.
INSERT INTO test.t1 VALUES (3, 4);
ERROR HY000: Schema 'S' is in read only mode.
ALTER SCHEMA S READ ONLY=0;
INSERT INTO S.t1 VALUES (1, 2);
INSERT INTO test.t1 VALUES (3, 4);
DROP TRIGGER S.ins_upd;
ALTER SCHEMA S READ ONLY=1;
DROP TRIGGER test.ins_upd;
DROP TABLE test.t1;
#--------------------------------------------------------------------
# Events.
#--------------------------------------------------------------------
# Restart to get a separate log file.
# restart: --log-error=MYSQLD_LOG
CREATE TABLE test.t1 LIKE S.t1;
CREATE EVENT test.ev
ON SCHEDULE EVERY 1 SECOND DO INSERT INTO S.t1 VALUES (1, 2);
CREATE EVENT S.ev
ON SCHEDULE EVERY 1 SECOND DO INSERT INTO test.t1 VALUES (1, 2);
ERROR HY000: Schema 'S' is in read only mode.
ALTER SCHEMA S READ ONLY=0;
CREATE EVENT S.ev
ON SCHEDULE EVERY 1 SECOND DO INSERT INTO test.t1 VALUES (1, 2);
ALTER SCHEMA S READ ONLY=1;
ALTER EVENT S.ev DISABLE;
ERROR HY000: Schema 'S' is in read only mode.
DROP EVENT S.ev;
ERROR HY000: Schema 'S' is in read only mode.
# Reject executing events located in a read only schema because
# last_executed timestamp must be updated.
Pattern not found.
Pattern not found.
#--------------------------------------------------------------------
# Reject executing events accessing read only entities.
#--------------------------------------------------------------------
Pattern not found.
Pattern not found.
ALTER SCHEMA S READ ONLY=0;
ALTER EVENT S.ev DISABLE;
DROP EVENT S.ev;
DROP EVENT test.ev;
DROP TABLE test.t1;
ALTER SCHEMA S READ ONLY=1;
#--------------------------------------------------------------------
# Non-cascading foreign keys.
#--------------------------------------------------------------------
CREATE TABLE test.p (
id INT NOT NULL,
PRIMARY KEY (id)
);
INSERT INTO test.p VALUES (1), (2), (3), (4);
ALTER SCHEMA S READ ONLY=0;
CREATE TABLE S.c (
p_id INT,
FOREIGN KEY (p_id)
REFERENCES test.p(id)
);
INSERT INTO S.c VALUES (1), (2);
ALTER SCHEMA S READ ONLY=1;
DELETE FROM test.p WHERE id=1;
ERROR 23000: Cannot delete or update a parent row: a foreign key constraint fails (`S`.`c`, CONSTRAINT `c_ibfk_1` FOREIGN KEY (`p_id`) REFERENCES `test`.`p` (`id`))
DELETE FROM test.p WHERE id=4;
SELECT * FROM test.p;
id
1
2
3
SELECT * FROM S.c;
p_id
1
2
# Parent of non-cascading FK may be locked.
LOCK TABLE test.p WRITE;
UNLOCK TABLES;
ALTER SCHEMA S READ ONLY=0;
DROP TABLE S.c;
#--------------------------------------------------------------------
# Cascading foreign keys.
#--------------------------------------------------------------------
INSERT INTO test.p VALUES (4);
CREATE TABLE S.c (
p_id INT,
FOREIGN KEY (p_id)
REFERENCES test.p(id)
ON DELETE CASCADE
ON UPDATE CASCADE
);
INSERT INTO S.c VALUES (1), (2);
ALTER SCHEMA S READ ONLY=1;
# Prelocking will reject any parent update/delete + LOCK TABLE.
DELETE FROM test.p WHERE id=1;
ERROR HY000: Schema 'S' is in read only mode.
DELETE FROM test.p WHERE id=4;
ERROR HY000: Schema 'S' is in read only mode.
UPDATE test.p SET id=5 WHERE id=2;
ERROR HY000: Schema 'S' is in read only mode.
UPDATE test.p SET id=5 WHERE id=4;
ERROR HY000: Schema 'S' is in read only mode.
LOCK TABLE test.p WRITE;
ERROR HY000: Schema 'S' is in read only mode.
#--------------------------------------------------------------------
# Turning off FKC will allow changes and skip updating child, but still
# reject LOCK TABLE.
#--------------------------------------------------------------------
SET @@session.foreign_key_checks=0;
DELETE FROM test.p WHERE id=1;
DELETE FROM test.p WHERE id=4;
UPDATE test.p SET id=5 WHERE id=2;
UPDATE test.p SET id=2 WHERE id=3;
SELECT * FROM test.p;
id
2
5
SELECT * FROM S.c;
p_id
1
2
LOCK TABLE test.p WRITE;
ERROR HY000: Schema 'S' is in read only mode.
SET @@session.foreign_key_checks=1;
#--------------------------------------------------------------------
# Turning off read only will allow changes and update child + allow
# LOCK TABLE.
#--------------------------------------------------------------------
ALTER SCHEMA S READ ONLY=0;
UPDATE test.p SET id=6 WHERE id=2;
SELECT * FROM test.p;
id
5
6
SELECT * FROM S.c;
p_id
1
6
DELETE FROM test.p WHERE id=6;
SELECT * FROM test.p;
id
5
SELECT * FROM S.c;
p_id
1
LOCK TABLE test.p WRITE;
#--------------------------------------------------------------------
# LOCK will block altering schema from same connection.
#--------------------------------------------------------------------
ALTER SCHEMA S READ ONLY=1;
ERROR HY000: Can't execute the given command because you have active locked tables or an active transaction
UNLOCK TABLES;
ALTER SCHEMA S READ ONLY=1;
#--------------------------------------------------------------------
# Trigger deleting/updating parent with a cascading FK child in
# read only schema.
#--------------------------------------------------------------------
CREATE TABLE test.t(i INT);
CREATE TRIGGER test.ins_upd
BEFORE INSERT ON test.t FOR EACH ROW
UPDATE test.p SET id = id + 1 WHERE id = NEW.i;
CREATE TRIGGER test.ins_del
AFTER INSERT ON test.t FOR EACH ROW DELETE FROM test.p WHERE id = NEW.i-1;
SELECT * FROM test.p;
id
5
SELECT * FROM S.c;
p_id
1
INSERT INTO test.t VALUES (4);
ERROR HY000: Schema 'S' is in read only mode.
LOCK TABLE test.t WRITE;
ERROR HY000: Schema 'S' is in read only mode.
ALTER SCHEMA S READ ONLY=0;
INSERT INTO test.t VALUES (4);
SELECT * FROM test.p;
id
5
SELECT * FROM S.c;
p_id
1
# LOCK TABLES of table in read only schema.
ALTER SCHEMA S READ ONLY=1;
LOCK TABLE S.c WRITE;
ERROR HY000: Schema 'S' is in read only mode.
# Restart with default log file.
# restart:
# Intermediate cleanup.
ALTER SCHEMA S READ ONLY=0;
DROP SCHEMA S;
DROP TABLE test.t;
DROP TABLE test.p;
#--------------------------------------------------------------------
# The option shall not have any affect on temporary tables.
#--------------------------------------------------------------------
CREATE SCHEMA S;
ALTER SCHEMA S READ ONLY=1;
CREATE TEMPORARY TABLE S.t(i INT);
INSERT INTO S.t VALUES(1);
SELECT * FROM S.t;
i
1
DROP TABLE S.t;
ALTER SCHEMA S READ ONLY=0;
DROP SCHEMA S;
#--------------------------------------------------------------------
# Conflicting options.
#--------------------------------------------------------------------
CREATE SCHEMA S;
ALTER SCHEMA S READ ONLY = 0 READ ONLY = 0;
ALTER SCHEMA S READ ONLY = 0 READ ONLY = 1;
ERROR HY000: Conflicting declarations: 'READ ONLY=0' and 'READ ONLY=1'
ALTER SCHEMA S READ ONLY = 0 READ ONLY = DEFAULT;
ALTER SCHEMA S READ ONLY = 1 READ ONLY = 0;
ERROR HY000: Conflicting declarations: 'READ ONLY=0' and 'READ ONLY=1'
ALTER SCHEMA S READ ONLY = 1 READ ONLY = 1;
ALTER SCHEMA S READ ONLY = 1 READ ONLY = DEFAULT;
ERROR HY000: Conflicting declarations: 'READ ONLY=0' and 'READ ONLY=1'
ALTER SCHEMA S READ ONLY = DEFAULT READ ONLY = 0;
ALTER SCHEMA S READ ONLY = DEFAULT READ ONLY = 1;
ERROR HY000: Conflicting declarations: 'READ ONLY=0' and 'READ ONLY=1'
ALTER SCHEMA S READ ONLY = DEFAULT READ ONLY = DEFAULT;
DROP SCHEMA S;
#--------------------------------------------------------------------
# ALTER READ ONLY allowed for read only schema.
#--------------------------------------------------------------------
CREATE SCHEMA S;
ALTER SCHEMA S READ ONLY=1;
SHOW CREATE SCHEMA S;
Database	Create Database
S	CREATE DATABASE `S` /*!40100 DEFAULT CHARACTER SET utf8mb4 COLLATE utf8mb4_0900_ai_ci */ /*!80016 DEFAULT ENCRYPTION='N' */ /* READ ONLY = 1 */
ALTER SCHEMA S READ ONLY=DEFAULT;
SHOW CREATE SCHEMA S;
Database	Create Database
S	CREATE DATABASE `S` /*!40100 DEFAULT CHARACTER SET utf8mb4 COLLATE utf8mb4_0900_ai_ci */ /*!80016 DEFAULT ENCRYPTION='N' */
ALTER SCHEMA S READ ONLY=1;
Repeated READ ONLY = 1 is allowed
ALTER SCHEMA S READ ONLY=1;
SHOW CREATE SCHEMA S;
Database	Create Database
S	CREATE DATABASE `S` /*!40100 DEFAULT CHARACTER SET utf8mb4 COLLATE utf8mb4_0900_ai_ci */ /*!80016 DEFAULT ENCRYPTION='N' */ /* READ ONLY = 1 */
ALTER SCHEMA S READ ONLY=0;
DROP SCHEMA S;
#--------------------------------------------------------------------
# ALTER SCHEMA rejected for read only schema.
#--------------------------------------------------------------------
CREATE SCHEMA S;
ALTER SCHEMA S READ ONLY=1;
SHOW CREATE SCHEMA S;
Database	Create Database
S	CREATE DATABASE `S` /*!40100 DEFAULT CHARACTER SET utf8mb4 COLLATE utf8mb4_0900_ai_ci */ /*!80016 DEFAULT ENCRYPTION='N' */ /* READ ONLY = 1 */
ALTER SCHEMA S COLLATE utf8mb4_bin;
ERROR HY000: Schema 'S' is in read only mode.
SHOW CREATE SCHEMA S;
Database	Create Database
S	CREATE DATABASE `S` /*!40100 DEFAULT CHARACTER SET utf8mb4 COLLATE utf8mb4_0900_ai_ci */ /*!80016 DEFAULT ENCRYPTION='N' */ /* READ ONLY = 1 */
ALTER SCHEMA S READ ONLY=0;
DROP SCHEMA S;
#--------------------------------------------------------------------
# ALTER SCHEMA for a mix of options.
#--------------------------------------------------------------------
CREATE SCHEMA S;
ALTER SCHEMA S READ ONLY=1;
ALTER SCHEMA S READ ONLY = 1 COLLATE utf8mb4_bin;
ERROR HY000: Schema 'S' is in read only mode.
ALTER SCHEMA S READ ONLY = 0 COLLATE utf8mb4_bin;
SHOW CREATE SCHEMA S;
Database	Create Database
S	CREATE DATABASE `S` /*!40100 DEFAULT CHARACTER SET utf8mb4 COLLATE utf8mb4_bin */ /*!80016 DEFAULT ENCRYPTION='N' */
ALTER SCHEMA S READ ONLY = 1 COLLATE utf8mb4_general_ci;
ALTER SCHEMA S READ ONLY=0;
DROP SCHEMA S;
CALL mtr.add_suppression("Can't create database 'S'; database exists");
CALL mtr.add_suppression("Query apply failed");
CALL mtr.add_suppression("Access to system schema 'mysql' is rejected.");
